{
  "schema_version": "1.0",
  "project_id": "neon-blasters",
  "time_budget_minutes": 4320,
  "reserve_minutes": 960,
  "tasks": [
    {"id":"NB-001","title":"Isolated source, build, evidence scaffold and browser proof","estimate_minutes":100,"measured_minutes":null,"priority":5,"depends_on":[],"mandatory":true,"owner_role":"integrator","status":"done","evidence":["projects/neon-blasters/src/index.html","HTTP smoke test pending"]},
    {"id":"NB-002","title":"Art direction, reference principles and original first-pixel proof","estimate_minutes":80,"measured_minutes":null,"priority":5,"depends_on":["NB-001"],"mandatory":true,"owner_role":"art-director","status":"done","evidence":["projects/neon-blasters/docs/art-bible.json","Founder references retained outside shipping assets"]},
    {"id":"NB-003","title":"Seeded fixed-step simulation and event contract tests","estimate_minutes":210,"measured_minutes":null,"priority":5,"depends_on":["NB-001"],"mandatory":true,"owner_role":"gameplay-engineer","status":"in_progress","evidence":["projects/neon-blasters/src/simulation.js","projects/neon-blasters/tests/simulation.test.cjs"]},
    {"id":"NB-004","title":"Pointer, keyboard and visibility-safe input","estimate_minutes":120,"measured_minutes":null,"priority":5,"depends_on":["NB-003"],"mandatory":true,"owner_role":"gameplay-engineer","status":"in_progress","evidence":["projects/neon-blasters/src/input.js"]},
    {"id":"NB-005","title":"Beam intersection, survival spawns, overload and restart","estimate_minutes":165,"measured_minutes":null,"priority":5,"depends_on":["NB-003","NB-004"],"mandatory":true,"owner_role":"gameplay-engineer","status":"in_progress","evidence":["projects/neon-blasters/src/simulation.js"]},
    {"id":"NB-006","title":"Immediate-feel vertical slice and rendered browser run","estimate_minutes":120,"measured_minutes":null,"priority":5,"depends_on":["NB-005"],"mandatory":true,"owner_role":"integrator","status":"ready","evidence":["projects/neon-blasters/src/index.html","browser evidence pending"]},
    {"id":"NB-007","title":"Spectrum matching, four families and bounded chain mechanics","estimate_minutes":210,"measured_minutes":null,"priority":5,"depends_on":["NB-005"],"mandatory":true,"owner_role":"gameplay-engineer","status":"in_progress","evidence":["projects/neon-blasters/src/simulation.js","projects/neon-blasters/tests/simulation.test.cjs"]},
    {"id":"NB-008","title":"Fracture stages, particle pools, splitter, Overdrive and power-ups","estimate_minutes":240,"measured_minutes":null,"priority":5,"depends_on":["NB-007"],"mandatory":true,"owner_role":"gameplay-engineer","status":"in_progress","evidence":["projects/neon-blasters/src/effects.js","projects/neon-blasters/src/renderer-canvas2d.js"]},
    {"id":"NB-009","title":"HUD, upgrade offers, local score and accessibility settings","estimate_minutes":150,"measured_minutes":null,"priority":4,"depends_on":["NB-006","NB-007"],"mandatory":true,"owner_role":"ui-engineer","status":"in_progress","evidence":["projects/neon-blasters/src/app.js"]},
    {"id":"NB-010","title":"WebGL2 effects and Canvas2D fallback with context recovery","estimate_minutes":150,"measured_minutes":null,"priority":3,"depends_on":["NB-008"],"mandatory":false,"owner_role":"rendering-engineer","status":"in_progress","evidence":["projects/neon-blasters/src/renderer-webgl.js","projects/neon-blasters/src/renderer-canvas2d.js"]},
    {"id":"NB-011","title":"Procedural audio, mute and pause behavior","estimate_minutes":75,"measured_minutes":null,"priority":3,"depends_on":["NB-006"],"mandatory":false,"owner_role":"audio-engineer","status":"in_progress","evidence":["projects/neon-blasters/src/audio.js"]},
    {"id":"NB-012","title":"Browser regressions, stress measurements and viewport visual QA","estimate_minutes":360,"measured_minutes":null,"priority":5,"depends_on":["NB-006","NB-008","NB-009","NB-010","NB-011"],"mandatory":true,"owner_role":"qa-engineer","status":"ready","evidence":["projects/neon-blasters/tests/simulation.test.cjs","evidence/neon-blasters pending"]},
    {"id":"NB-013","title":"License/provenance audit, clean package, hashes and release evidence","estimate_minutes":260,"measured_minutes":null,"priority":5,"depends_on":["NB-012"],"mandatory":true,"owner_role":"release-engineer","status":"ready","evidence":["builds/neon-blasters pending","evidence/neon-blasters pending"]}
  ]
}
