{
  "schema_version": "1.0",
  "project_id": "the-unwriters-almanac",
  "time_budget_minutes": 1440,
  "reserve_minutes": 360,
  "tasks": [
    {
      "id": "UA-001",
      "title": "Create isolated runnable local project shell",
      "estimate_minutes": 35,
      "priority": 5,
      "depends_on": [],
      "mandatory": true,
      "owner_role": "integrator",
      "status": "done",
      "evidence": [
        "package.json",
        "scripts/serve.mjs",
        "src/index.html"
      ]
    },
    {
      "id": "UA-002",
      "title": "Create brief, art bible, task and provenance contracts",
      "estimate_minutes": 40,
      "priority": 5,
      "depends_on": [
        "UA-001"
      ],
      "mandatory": true,
      "owner_role": "producer",
      "status": "done",
      "evidence": [
        "docs/game-brief.json",
        "docs/art-bible.json",
        "docs/production-project.json",
        "docs/asset-manifest.json",
        "docs/task-graph.json"
      ]
    },
    {
      "id": "UA-003",
      "title": "Create responsive authored watercolor page visual proof",
      "estimate_minutes": 50,
      "priority": 5,
      "depends_on": [
        "UA-001",
        "UA-002"
      ],
      "mandatory": true,
      "owner_role": "art-director",
      "status": "done",
      "evidence": [
        "src/renderer.js",
        "src/styles.css"
      ]
    },
    {
      "id": "UA-004",
      "title": "Define deterministic puzzle simulation and fixed-step state",
      "estimate_minutes": 55,
      "priority": 5,
      "depends_on": [
        "UA-001",
        "UA-002"
      ],
      "mandatory": true,
      "owner_role": "gameplay-engineer",
      "status": "done",
      "evidence": [
        "src/simulation.js",
        "src/geometry.js",
        "tests/simulation.test.mjs"
      ]
    },
    {
      "id": "UA-005",
      "title": "Normalize and preview pointer plus keyboard stroke editing",
      "estimate_minutes": 65,
      "priority": 5,
      "depends_on": [
        "UA-004"
      ],
      "mandatory": true,
      "owner_role": "gameplay-engineer",
      "status": "done",
      "evidence": [
        "src/input.js",
        "tests/input.test.mjs"
      ]
    },
    {
      "id": "UA-006",
      "title": "Implement rail traversal, collision and pigment guidance",
      "estimate_minutes": 100,
      "priority": 5,
      "depends_on": [
        "UA-005"
      ],
      "mandatory": true,
      "owner_role": "gameplay-engineer",
      "status": "done",
      "evidence": [
        "src/simulation.js",
        "tests/simulation.test.mjs"
      ]
    },
    {
      "id": "UA-007",
      "title": "Implement solved, pause, erase and restart states",
      "estimate_minutes": 40,
      "priority": 5,
      "depends_on": [
        "UA-006"
      ],
      "mandatory": true,
      "owner_role": "gameplay-engineer",
      "status": "done",
      "evidence": [
        "src/simulation.js",
        "src/app.js",
        "tests/simulation.test.mjs"
      ]
    },
    {
      "id": "UA-008",
      "title": "Playtest and tune first browser loop",
      "estimate_minutes": 40,
      "priority": 5,
      "depends_on": [
        "UA-003",
        "UA-007"
      ],
      "mandatory": true,
      "owner_role": "integrator",
      "status": "done",
      "evidence": [
        "evidence/the-unwriters-almanac/verification.json"
      ]
    },
    {
      "id": "UA-009",
      "title": "Author identity-stable character animation states",
      "estimate_minutes": 85,
      "priority": 4,
      "depends_on": [
        "UA-008"
      ],
      "mandatory": true,
      "owner_role": "animation-artist",
      "status": "done",
      "evidence": [
        "src/animation.js",
        "src/renderer.js"
      ]
    },
    {
      "id": "UA-010",
      "title": "Add bounded watercolor wash and authored-page detail",
      "estimate_minutes": 55,
      "priority": 3,
      "depends_on": [
        "UA-008"
      ],
      "mandatory": true,
      "owner_role": "technical-artist",
      "status": "done",
      "evidence": [
        "src/renderer.js",
        "src/styles.css"
      ]
    },
    {
      "id": "UA-011",
      "title": "Add instruction, keyboard accessibility and feedback",
      "estimate_minutes": 55,
      "priority": 5,
      "depends_on": [
        "UA-008"
      ],
      "mandatory": true,
      "owner_role": "ux-engineer",
      "status": "done",
      "evidence": [
        "src/index.html",
        "src/app.js",
        "src/input.js"
      ]
    },
    {
      "id": "UA-012",
      "title": "Integrate solve and recovery choreography",
      "estimate_minutes": 35,
      "priority": 4,
      "depends_on": [
        "UA-009",
        "UA-010",
        "UA-011"
      ],
      "mandatory": true,
      "owner_role": "animation-artist",
      "status": "done",
      "evidence": [
        "src/animation.js",
        "src/renderer.js",
        "src/app.js"
      ]
    },
    {
      "id": "UA-013",
      "title": "Test geometry, state, determinism and input failure paths",
      "estimate_minutes": 35,
      "priority": 5,
      "depends_on": [
        "UA-004",
        "UA-005",
        "UA-006",
        "UA-007",
        "UA-012"
      ],
      "mandatory": true,
      "owner_role": "qa-engineer",
      "status": "done",
      "evidence": [
        "tests/simulation.test.mjs",
        "tests/input.test.mjs"
      ]
    },
    {
      "id": "UA-014",
      "title": "Integrate app, renderer and animation with bounded timing",
      "estimate_minutes": 45,
      "priority": 5,
      "depends_on": [
        "UA-013"
      ],
      "mandatory": true,
      "owner_role": "integrator",
      "status": "done",
      "evidence": [
        "src/app.js",
        "src/renderer.js"
      ]
    },
    {
      "id": "UA-015",
      "title": "Adversarial browser traversal and recovery testing",
      "estimate_minutes": 80,
      "priority": 5,
      "depends_on": [
        "UA-014"
      ],
      "mandatory": true,
      "owner_role": "qa-engineer",
      "status": "done",
      "evidence": [
        "evidence/the-unwriters-almanac/verification.json"
      ]
    },
    {
      "id": "UA-016",
      "title": "Review visual and accessible states at two viewports",
      "estimate_minutes": 55,
      "priority": 5,
      "depends_on": [
        "UA-015"
      ],
      "mandatory": true,
      "owner_role": "visual-qa",
      "status": "done",
      "evidence": [
        "evidence/the-unwriters-almanac/verification.json"
      ]
    },
    {
      "id": "UA-017",
      "title": "Measure representative timings and resource bounds",
      "estimate_minutes": 35,
      "priority": 4,
      "depends_on": [
        "UA-014",
        "UA-015"
      ],
      "mandatory": true,
      "owner_role": "performance-engineer",
      "status": "done",
      "evidence": [
        "evidence/the-unwriters-almanac/performance.json"
      ]
    },
    {
      "id": "UA-018",
      "title": "Audit provenance, rights state and local build evidence",
      "estimate_minutes": 35,
      "priority": 5,
      "depends_on": [
        "UA-016",
        "UA-017"
      ],
      "mandatory": true,
      "owner_role": "release-engineer",
      "status": "done",
      "evidence": [
        "evidence/the-unwriters-almanac/source-manifest.json",
        "evidence/the-unwriters-almanac/verification.json"
      ]
    },
    {
      "id": "UA-019",
      "title": "Run final regression checks and record handoff",
      "estimate_minutes": 30,
      "priority": 5,
      "depends_on": [
        "UA-018"
      ],
      "mandatory": true,
      "owner_role": "integrator",
      "status": "done",
      "evidence": [
        "evidence/the-unwriters-almanac/verification.json"
      ]
    }
  ]
}
